Mata Pelajaran,Study Tips
Matematika,"Hal yang harus kamu tingkatkan dalam mempelajari mata pelajaran matematika adalah frekuensi dalam mengerjakan latihan soal yang telah diberikan oleh gurumu.Kamu juga lebih harus memahami konsep dasar dari materi yang diujikan oleh gurumu. Selain itu, Membuat catatan rumus dengan rapi dan memahami rumusnya bukan menghafalnya dapat membantu kamu dalam mengerjakan soal."
Kimia,"Tips belajar agar kamu dapat meningkatkan nilai pada mata pelajaran kimia adalah kamu harus memahami konsep dasar dari materi yang diujikan oleh gurumu, membuat catatan dan mempelajari dari penjelasan gurumu juga merupakan salah satu tips belajar. Selain itu, mengerjakan soal latihan yang berhubungan dengan materi yang diujikan dengan sering dapat membantu kamu dalam memahami materi yang diujikan."
Biologi,"Tips untuk meningkatkan nilai biologi kamu dapat dengan cara sering mencatat, mereview dan memahami materi yang diberikan oleh gurumu. Mengerjakan latihan soal untuk membantu kamu memahami dari berbagai tipe soal juga dapat membantu kamu dalam menghadapi ujian. Mencari sumber referensi lain terkait materi yang diujikan, seperti dari buku, artikel, dan lainnya juga dapat meningkatkan pemahamanmu terhadap materi."
Fisika,"Hal yang harus kamu lakukan untuk meningkatkan pemahamanmu terhadap mata pelajaran fisika adalah memahami konsep dasar dari materi yang diujikan. Hal tersebut dapat dilakukan dengan cara meriew catatean yang kamu buat dan mengerjakan latihan soal, seperti dari tugas, soal-soal yang ada di buku, soal ujian yang lalu, dan sebagainya. Selain itu, jangan menghafal rumus tetapi kamu harus memahami rumus lalu diaplikasikan pada soal-soal yang kamu kerjakan."
Geografi,"Menggunakan berbagai sumber belajar, seperti dari buku, artikel, internet dapat membantu kamu dalam mengerjakan soal ujian yang diberikan gurumu. Kamu juga dapat membuat catatan yang menarik dan selengkap mungkin serta harus sering mereview materi yang akan diujikan. Geografi sebenarnya bukan mata pelajaran yang mengandalkan hafalan saja, hilangkan anggapan tersebut karena geografi juga membutuhkan pemahaman yang baik dalam mengerjakan tipe-tipe soal, seperti studi kasus."
Sosiologi,Cara untuk meningkatkan pemahamanmu terhadap materi yang diujikan pada mata pelajaran sosiologi dapat dengan mencatat materi baik dari penjelasan gurumu ataupun dari berbagai sumber lain. Kamu dapat memahami teori-teori sosiologi yang berasal dari catatanmu ataupun menonton video-video terkait fenomena sosial yang berkaitan dengan materi yang diujikan. Kamu juga dapat bertanya kepada guru atau teman belajarmu saat kamu mengalami kesulitan dalam memahami materi.
Ekonomi,"Untuk meningkatkan nilai pada materi yang diujikan kamu dapat menonton video atau mereview materi untuk meningkatkan pemahaman atas konsep dasar dari materi yang diujikan. Membaca materi dari sumber lain, seperti buku, artikel, dan sebagainya juga dianjurkan untuk mempeluas pengetahuanmu. Selain itu, ekonomi juga terdapat soal-soal yang membutuhkan perhitungan, untuk mengatasi hal tersebut, kamu dapat meingkatkan kemampuan matematikamu dan mengerjakan latihan soal ekonomi terkait materi tersebut."
Sejarah,"Kamu dapat meningkatkan nilaimu pada mata pelajaran sejarah dengan cara mencatat rangkaian peristiwa dalam sejarah dengan lengkap dan menarik agar tidak bosan saat membacanya. Selain itu juga, kamu dapat mecatat tanggal-tanggal yang penting dalam catatan tersebut. Menonton film dokumenter sejarah yang terkait dengan materi juga dapat membantu memahami materi tersebut. Membaca buku -buku sejarah selain buku pelajarnmu juga dianjurkan."
Pendidikan Jasmani,"Dalam mempelajari pendidikan jasmani, kamu dapat melakukan praktek dengan menerapkan teori yang kamu pelajari saat kelas. Dengan hal tersebut kamu dapat memahami konsep dari gerakan atau materi yang kamu lakukan. Jika kamu merasa kesulitan, kamu dapat bertanya pada guru atau teman kamu."
Pendidikan Kewarganegaran,"Tips dalam belajar pendidikan kewarganegaraan dapat dilakukan dengan cara mencatat bagian-bagian yang penting dalam materi yang terkait. Soal pada pendidikan kewarganegaraan terkadang dalam bentuk studi kasus sehingga kamu harus dapat memahami materi yang terkait dengan ujianmu menggunakan catatan, video, ataupun sumber lainnya. Memperbanyak pengerjaan soal yang berbentuk studi kasus juga dapat membantumu dalam memahami materi. "
Kewirausahaan,Study tips untuk mempelajari mata pelajaran kewirausahaan adalah dapat melakukan study group bersama temanmu untuk berdiskusi materi yang menurutmu sulit. Kamu juga harus mencatat poin-poin yang penting dan memahami poin-poin tersebut sehingga memudahkanmu dalam belajar kewirausahaan.
Agama Islam,"Meningkatkan nilai pada pelajaran agama islam dapat dengan cara mencatat penjelasan dari gurumu dan setelah itu kamu mereview kembali yang diajarkan tadi. Kamu juga dapat mulai memahami isi dari kitab Al-Qur'an dan mengimplementasikannya pada kehidupan sehari-hari juga dapat membantu kamu dalam memahami konsep dari materi yang diajarkan. Menonton video ceramah, membaca artikel islam juga dapat membantu hal tersebut."
Seni,"Mepraktekkan materi seni yang diajarkan, seperti seni musik, seni tari, ataupun seni terapan dapat meningkatkanmu dalam memahami pelajaran seni budaya. Memahami dan mencatatat materi yang diajarkan gurumu dengan menarik juga dapat membantu hal tersebut. Selain itu, kamu juga dapat meminta bantuan temanmu sebagai partner belajar untuk meningkatkan kemampuan menghafalmu terhadap materi seni budaya yang diajarkan oleh gurumu."
Ilmu Komputer,"Mencatat dan memahami materi yang diajarkan oleh gurumu dapat membantu kamu dalam mempelajari ilmu komputer. Menerapkan teori yang dipelajarii di komputer juga membantumu dalam meningkatkan pemahaman terhadap materi yang diajarkan. Memanfaatkan internet untuk mencari referensi belajar, seperti artikel dan video juga membantu hal tersebut."
Bahasa Indonesia,"Membiasakan diri untuk membaca buku dapat membantu kamu dalam mempelajari bahasa Indonesia. Dengan membaca buku, kamu memperoleh kosakata baru, memahami struktur kalimat, penggunaan kalimat dengan baik, dan lainnya. Kamu juga dapat membiasakan diri dengan penggunaan bahasa baku saat sedang menulis dan berinteraksi saat keadaan formal. Selain itu, kamu juga dapat memahami berbagai jenis definisi, bentuk, serta kegunaan materi dari pelajaran Bahasa Indonesia"
Bahasa Inggris,"Membaca artikel, buku, dan berita yang menggunakan bahasa inggris dapat membantu kamu dalam meningkatkan nilai pada pelajaran bahasa Inggris. Sering mempraktekkan penggunaan bahasa Inggris dan jangan takut salah dalam pengucapannya juga dapat membantu dalam pemahamanmu terhadap bahasa Inggris. Untuk menambah kosakata bahasa Inggris, kamu dapat menggunakan kamus serta media hiburan, seperti film."
Agama Kristen,"Membaca buku yang berkaitan dengan agama Kristen dapat membantu kamu dalam memahami mata pelajaran agama Kristen. Lalu, pada saat kelas, kamu dapat mengamati dan memahami apa yang diajarkan gurumu dan mencatat poin-poin yang penting dari materi tersebut. Kamu juga dapat menonton video-video yang berkaitan dengan materimu sehingga menambah pemahamanmu terhadap materi yang diujikan pada mata pelajaran agama kristen"
Agama Hindu,"Cara untuk membantu kamu dalam memahami materi yang diujikan pada mata pelajaran agama Hindu adalah dengan cara memahami dengan cermat penjelasan gurumu saat sedang mengajar. Lalu, kamu dapat mencatat kembali dan memahaminya sehingga membantu kamu dalam meningkatkan nilai ujianmu. Kamu juga dapat menggunakan internet untuk mengakses video-video ceramah untuk menambah pengetahuanmu."
Agama Budha,"TIps belajar agama Budha adalah dengan cara mencatat dan mereview kembali materi yang telah dijelaskan oleh gurumu di kelas. Membaca dan memahami kitab suci agama Buddha juga dapat membantu kamu mengerti tentang materi-materi yang diujikan. Selain itu, mendengarkan ceramah juga dapat membantu hal tersebut."
Bahasa Jepang,"Memahami materi dan menggunakan kamus untuk menambah kosakata bahasa Jepang kamu merupakan cara untuk meningkatkan pemahamanmu terhadap mata pelajaran bahasa Jepang. Kamu juga dapat menggunakan media hiburan, seperti film tanpa subtittle ataupun komik yang berbahasa jepang juga membantu kamu dalam memahami bahasa Jepang. Selain itu, kamu harus sering mempraktekkan bahasa Jepang dengan guru atau temanmu."
Bahasa Mandarin,"Untuk meningkatkan nilai dan pemahamanmu terhadap bahasa Mandarin, kamu dapat melakukannya dengan cara membaca literatur yang menggunakan bahasa Mandarin. Selain itu, unutk menambah kosakata bahasa Mandarin, kamu dapat menggunakan kamus dan cobalah untuk memahami cara menulis huruf Mandarin dengan benar. Mereview materi yang berasa dari gurumu dan mempraktekkannya dengan temanmu juga membantu kamu dalam memahami bahasa Mandarin"
Bahasa Korea,"Menggunakan media hiburan, seperti film tanpa menggunakan subtittle juga dapat membantumu dalam meningkatkan pemahaman dan menambah kosakata pada bahasa Korea. Selain itu, kamu juga dapat mempraktekkanya secara langsung dengan teman belajarmu dan jangan takut salah dalam pengucapannya agar kamu dapat terus berkembang. Mencatat materi dan memahaminya juga dapat membantumu dalam memahami mata pelajaran bahasa Korea "
Bahasa Belanda,"Dalam mempelajari bahasa Belanda, kamu dapat memulai dengan mempraktekkan bahasa Belanda yang telah diajari oleh gurumu. Kamu juga dapat menggunakan internet, untuk membaca artikel, berita, atau lainnya untuk memahami bahasa Belanda. Dengan hal tersebut serta menggunakan kamus, kamu dapat menambah kosakata bahasa Belanda kamu."
Bahasa Prancis,"Untuk meningkatkan pemahanmu dalam memperbaiki nilaimu dalam mata pelajaran bahasa Prancis adalah dengan cara sering mempraktekkannya dengan teman belajarmu. Kamu juga dapat memahami lagi materi yang disampaikan oleh gurumu dan jika kamu kesulitan kamu dapat bertanya pada gurumu atau pada temanmu. Penggunaan internet untuk mengakses berita, artikel, jurnal, dan sebagainya yang menggunakan bahasa Prancis juga membantu kamu dalam mempelajari bahasa Prancis"
Bahasa Arab,"Tips belajar bahasa Arab untuk kamu adalah mulailah membaca berita, cerita, dan sebagainya yang menggunakan bahasa Arab. Kamu juga dapat menggunakan kamus dan menulis huruf-hurufnya untuk meningkatkan pemahaman dalam bahasa Arab. kamu juga dapat menghapal kosakata bahasa Arab dengan menggunakan buku bergambar untuk memudahkannya. Selain itu kamu juga dapat mempraktekkan penggunaan bahasa Arab dan jangan takut salah dalam pengucapannya"
Bahasa Jerman,"Hal yang harus kamu lakukan untuk meningkatkan nilaimu pada mata pelajar bahasa Jerman adalah mencatat dan memahami materi yang diberikan gurumu dan jika terdapat kesulitan kamu dapat menanyakannya. Selain itu, menggunakan bahasa Jerman dengan guru atau temanmu juga membantu hal tersebut. Penggunaan kamus dan internet untuk mengakses referensi belajar juga membantumu dalam menambah kosakata."
Bahasa Rusia,"Kamu dapat berbicara bahasa Rusia dengan temanmu pada saat senggang untuk membantumu memahami bahasa Rusia. Kamu juga dapat mencatat dan memahami materi dari gurumu untuk meningkatkan nilai bahasa Rusia kamu. Selain itu, kamu dapat menggunakan literatur, seperti buku, novel, dan sebagainya untuk kamu baca sehingga kamu dapat menambah kosakata dan memahami penggunaan kalimat dan strukrunya dengan benar."